{
  "id" : "lYK0zytu",
  "createTime" : "2024-12-18T23:13:33",
  "updateTime" : "2025-01-06T17:14:05",
  "name" : "/text-plain.txt",
  "method" : "GET",
  "url" : "http://localhost:8000/text-plain.txt",
  "headers" : [ {
    "type" : "TEXT",
    "key" : "X-Set-Response-Content-Type",
    "value" : "text/plain",
    "selected" : true
  } ],
  "cookies" : [ ],
  "body" : {
    "type" : "NO_BODY"
  }
}