{
  "id" : "9LF0Losk",
  "createTime" : "2024-12-18T23:33:47",
  "updateTime" : "2025-01-06T16:56:40",
  "name" : "/echo.php?selected-file",
  "method" : "POST",
  "url" : "http://localhost:8000/echo.php?selected-file",
  "headers" : [ ],
  "cookies" : [ ],
  "body" : {
    "type" : "BINARY",
    "binary" : {
      "contentType" : "application/octet-stream",
      "file" : "C:\\Users\\claudio\\OneDrive\\Documentos\\BhuiyanManuscript.pdf"
    }
  }
}