{
  "id" : "7M2S0Kxh",
  "createTime" : "2024-12-18T23:28:53",
  "updateTime" : "2025-01-08T16:29:34",
  "name" : "/echo.php?urlencoded-form",
  "method" : "POST",
  "url" : "{{echoServer}}/echo.php?urlencoded-form",
  "headers" : [ ],
  "cookies" : [ ],
  "body" : {
    "type" : "URL_ENCODED_FORM",
    "urlEncodedForm" : [ {
      "type" : "TEXT",
      "key" : "myparam1",
      "value" : "a",
      "selected" : true
    }, {
      "type" : "TEXT",
      "key" : "myparam2",
      "value" : "b",
      "selected" : true
    }, {
      "type" : "TEXT",
      "key" : "myparam3",
      "value" : "{{token}}",
      "selected" : true
    } ]
  }
}