{
  "id" : "Cio4Ribc",
  "createTime" : "2024-12-18T23:17:18",
  "updateTime" : "2024-12-18T23:18:40",
  "name" : "/hello-cookie",
  "method" : "GET",
  "url" : "http://localhost:8080/hello-cookie",
  "headers" : [ ],
  "cookies" : [ {
    "type" : "TEXT",
    "key" : "JSESSIONID",
    "value" : "50AE9F57B058D16C887177D9C79EF364",
    "selected" : true
  } ],
  "body" : {
    "type" : "NO_BODY"
  }
}