{
  "id" : "x4woN3gk",
  "createTime" : "2024-12-18T23:04:19",
  "updateTime" : "2024-12-18T23:05:35",
  "name" : "/hello-custom-header",
  "method" : "GET",
  "url" : "http://localhost:8080/hello-custom-header",
  "headers" : [ {
    "type" : "TEXT",
    "key" : "X-Burger",
    "value" : "ichi",
    "selected" : true
  } ],
  "cookies" : [ ],
  "body" : {
    "type" : "NO_BODY"
  }
}