{
  "id" : "55w7W0xw",
  "createTime" : "2024-12-18T23:06:02",
  "updateTime" : "2025-01-08T11:18:56",
  "name" : "/redirect.php",
  "method" : "GET",
  "url" : "{{echoServer}}/redirect.php",
  "headers" : [ {
    "type" : "TEXT",
    "key" : "x-set-response-status-code",
    "value" : "301",
    "selected" : true
  } ],
  "cookies" : [ ],
  "body" : {
    "type" : "NO_BODY"
  }
}