{
  "id" : "gtD5ZcKC",
  "createTime" : "2024-12-18T23:40:42",
  "updateTime" : "2025-01-08T11:19:36",
  "name" : "/xml-iso-8859-1.php",
  "method" : "GET",
  "url" : "{{echoServer}}/xml-iso-8859-1.php",
  "headers" : [ {
    "type" : "TEXT",
    "key" : "X-Set-Response-Content-Type",
    "value" : "text/xml; charset=iso-8859-1",
    "selected" : true
  } ],
  "cookies" : [ ],
  "body" : {
    "type" : "NO_BODY"
  }
}